{
  "schemaVersion": 1,
  "regions": [
    {
      "id": "upper-midwest",
      "name": "Minnesota–Dakotas / small-grain systems",
      "climate": "Cool continental; season length and soil-water supply vary substantially.",
      "scope": "Reference scenarios from Minnesota/North Dakota extension guidance; Brookings trial is a separate South Dakota benchmark. No state-wide agronomic validation.",
      "sourceIds": [
        "umn-small-grain-rotations"
      ],
      "review": {
        "status": "research-only",
        "reviewer": null,
        "date": null
      },
      "crops": [
        {
          "id": "wheat",
          "label": "Spring wheat",
          "group": "cereal"
        },
        {
          "id": "corn",
          "label": "Corn",
          "group": "cereal"
        },
        {
          "id": "soybean",
          "label": "Soybean",
          "group": "legume"
        },
        {
          "id": "canola",
          "label": "Canola",
          "group": "oilseed"
        },
        {
          "id": "barley",
          "label": "Barley",
          "group": "cereal"
        },
        {
          "id": "flax",
          "label": "Flax",
          "group": "oilseed"
        },
        {
          "id": "pea",
          "label": "Field pea",
          "group": "legume"
        },
        {
          "id": "winter-wheat",
          "label": "Winter wheat",
          "group": "cereal"
        }
      ],
      "scenarios": [
        {
          "id": "um-baseline",
          "name": "Wheat / corn / soybean",
          "phases": [
            "wheat",
            "corn",
            "soybean"
          ],
          "waterIntensification": false,
          "sourceIds": [
            "umn-small-grain-rotations"
          ],
          "note": "Extension Table 6, rotation one."
        },
        {
          "id": "um-diversity",
          "name": "Five-crop sequence",
          "phases": [
            "wheat",
            "canola",
            "barley",
            "flax",
            "soybean"
          ],
          "waterIntensification": false,
          "sourceIds": [
            "umn-small-grain-rotations"
          ],
          "note": "Extension Table 6, rotation four."
        },
        {
          "id": "um-cool",
          "name": "Cool-season diversity",
          "phases": [
            "winter-wheat",
            "canola",
            "barley",
            "pea",
            "flax"
          ],
          "waterIntensification": false,
          "sourceIds": [
            "umn-small-grain-rotations"
          ],
          "note": "Extension Table 6, rotation seven; winter survival requires local confirmation."
        }
      ]
    },
    {
      "id": "kansas-dryland",
      "name": "Western Kansas / Brownell dryland",
      "climate": "Semiarid central Great Plains; stored water can limit the following cash crop.",
      "scope": "HB Ranch wheat–sorghum–fallow experiment near Brownell. This does not cover all Kansas soils, irrigation systems or drought cycles.",
      "sourceIds": [
        "ks-cover-trial-2020"
      ],
      "review": {
        "status": "research-only",
        "reviewer": null,
        "date": null
      },
      "crops": [
        {
          "id": "wheat",
          "label": "Winter wheat",
          "group": "cereal"
        },
        {
          "id": "sorghum",
          "label": "Grain sorghum",
          "group": "cereal"
        },
        {
          "id": "fallow",
          "label": "Chemical fallow",
          "group": "fallow"
        },
        {
          "id": "oat-triticale",
          "label": "Oat–triticale cover",
          "group": "cover"
        }
      ],
      "scenarios": [
        {
          "id": "ks-fallow",
          "name": "Retain fallow",
          "phases": [
            "wheat",
            "sorghum",
            "fallow"
          ],
          "waterIntensification": false,
          "sourceIds": [
            "ks-cover-trial-2020"
          ],
          "note": "Study comparator."
        },
        {
          "id": "ks-cover",
          "name": "Standing cover replaces fallow",
          "phases": [
            "wheat",
            "sorghum",
            "oat-triticale"
          ],
          "waterIntensification": true,
          "sourceIds": [
            "ks-cover-trial-2020"
          ],
          "note": "Standing oat–triticale treatment."
        },
        {
          "id": "ks-forage",
          "name": "Harvest cover for forage",
          "phases": [
            "wheat",
            "sorghum",
            "oat-triticale"
          ],
          "waterIntensification": true,
          "requiresForage": true,
          "sourceIds": [
            "ks-cover-trial-2020"
          ],
          "note": "Haying treatment; retained residue and equipment differ from standing cover."
        }
      ]
    },
    {
      "id": "pnw-dryland",
      "name": "Pacific Northwest / Pendleton dryland",
      "climate": "Mediterranean rainfall pattern; dry summers, winter-dominant precipitation.",
      "scope": "CBARC Walla Walla silt loam study systems near Pendleton. Low-rainfall Columbia Plateau sites and irrigated systems are not interchangeable.",
      "sourceIds": [
        "pnw-carbon-2025",
        "osu-pea-management"
      ],
      "review": {
        "status": "research-only",
        "reviewer": null,
        "date": null
      },
      "crops": [
        {
          "id": "wheat",
          "label": "Winter wheat",
          "group": "cereal"
        },
        {
          "id": "pea",
          "label": "Spring pea",
          "group": "legume"
        },
        {
          "id": "fallow",
          "label": "Summer fallow",
          "group": "fallow"
        }
      ],
      "scenarios": [
        {
          "id": "pnw-fallow",
          "name": "Wheat / summer fallow",
          "phases": [
            "wheat",
            "fallow"
          ],
          "waterIntensification": false,
          "sourceIds": [
            "pnw-carbon-2025"
          ],
          "note": "Conventional-tillage comparator."
        },
        {
          "id": "pnw-pea-ct",
          "name": "Wheat / pea · conventional tillage",
          "phases": [
            "wheat",
            "pea"
          ],
          "waterIntensification": true,
          "sourceIds": [
            "pnw-carbon-2025"
          ],
          "note": "Conventional-tillage study treatment."
        },
        {
          "id": "pnw-pea-nt",
          "name": "Wheat / pea · no-till",
          "phases": [
            "wheat",
            "pea"
          ],
          "waterIntensification": true,
          "sourceIds": [
            "pnw-carbon-2025"
          ],
          "note": "No-till study treatment; tillage transition is part of the comparison."
        }
      ]
    }
  ],
  "benchmarks": [
    {
      "id": "sd-bd",
      "regionId": "upper-midwest",
      "metric": "Bulk density",
      "kind": "treatment-difference",
      "unit": "g/cm³",
      "treatment": 1.52,
      "comparator": 1.44,
      "value": null,
      "treatmentLabel": "Ridge tillage",
      "comparatorLabel": "Conventional tillage",
      "depth": "0–20 cm",
      "period": "1999 soil sampling; trial began 1990",
      "design": "Corn–soybean tillage trial, three N levels",
      "sampleSize": null,
      "location": "Brookings, South Dakota; Barnes clay loam",
      "sourceId": "sd-tillage-trial-2001",
      "sourceLocator": "Abstract, p. 21; soil-property results",
      "limitation": "Between-treatment difference, not a before/after change. Replicate count not extracted.",
      "confidence": "medium",
      "review": {
        "status": "research-only",
        "reviewer": null,
        "date": null
      }
    },
    {
      "id": "ks-yield",
      "regionId": "kansas-dryland",
      "metric": "Wheat grain yield",
      "kind": "treatment-difference",
      "unit": "bu/acre",
      "treatment": 41.8,
      "comparator": 51.9,
      "value": null,
      "treatmentLabel": "Cover treatments mean",
      "comparatorLabel": "Chemical fallow",
      "depth": "Not applicable",
      "period": "2016–2019 harvests",
      "design": "2015–2019 field experiment; all crop phases in each block",
      "sampleSize": null,
      "location": "HB Ranch near Brownell, Kansas",
      "sourceId": "ks-cover-trial-2020",
      "sourceLocator": "Abstract; Figure 3",
      "limitation": "Yield penalty occurred in two of four years. Treatment average is not a forecast.",
      "confidence": "medium",
      "review": {
        "status": "research-only",
        "reviewer": null,
        "date": null
      }
    },
    {
      "id": "ks-soc",
      "regionId": "kansas-dryland",
      "metric": "Organic carbon concentration",
      "kind": "qualitative",
      "unit": "%",
      "treatment": null,
      "comparator": null,
      "value": null,
      "treatmentLabel": "Cover crop",
      "comparatorLabel": "Fallow",
      "depth": "2–6 inches",
      "period": "2019",
      "design": "Field experiment; Figure 2",
      "sampleSize": null,
      "location": "HB Ranch near Brownell, Kansas",
      "sourceId": "ks-cover-trial-2020",
      "sourceLocator": "Abstract; Figure 2b",
      "limitation": "Higher under cover; no numerical delta transcribed from the graph. Surface 0–2 inch response differed. SOC is not SOM.",
      "confidence": "medium",
      "review": {
        "status": "research-only",
        "reviewer": null,
        "date": null
      }
    },
    {
      "id": "pnw-ct",
      "regionId": "pnw-dryland",
      "metric": "Soil carbon annual rate",
      "kind": "reported-rate",
      "unit": "t C/ha/year",
      "treatment": null,
      "comparator": null,
      "value": 0.15,
      "treatmentLabel": "Wheat–pea, conventional tillage",
      "comparatorLabel": null,
      "depth": "0–30 cm",
      "period": "Wheat–pea archives 1985–2021",